{
  "ID": "abc123",
  "insp_ident_1": "example-value",
  "insp_ident_2": "example-value",
  "insp_ident_3": "example-value",
  "part_number": "PART-001",
  "rev": "example-value",
  "part_description": "This is an example description.",
  "operation": "example-value",
  "customer_name": "Example Item",
  "supplier_name": "Example Item",
  "supplier_number": "12345",
  "project_identifier": "example-value",
  "site": "QC Lab",
  "created_by_name": "Example Item",
  "created_on": "example-value",
  "in_spec_pct": 100.0,
  "inspection_status": "Accepted",
  "inspected_by_name": "Will Stallard",
  "inspected_on": "2021-07-16T17:42:31-08:00",
  "review_status": "Pending",
  "reviewed_by_name": "Nipun Girotra",
  "reviewed_on": "2021-07-16T17:53:41-08:00",
  "notes": "Parts are discolored.",
  "ncrs": [
    "NCR-123",
    "NCR-456"
  ],
  "updated_on": "example-value",
  "closed_on": "example-value",
  "fai_type": "standard",
  "number_of_parts": "PART-001"
}